{
  "schemaVersion": 1,
  "releaseId": "wap-1.2.1",
  "generatedFrom": "spec-processing/source-manifests/wap-1.2.1-release.json",
  "governingConformanceDocument": "WAP-221-CREQ-20010425-a",
  "governingClassProfileDocument": "WAP-215-ClassConform-20001213-a",
  "classProfileLedger": "spec-processing/source-manifests/wap-1.2.1-class-conformance.json",
  "graphStatus": "source-precedence-complete-scr-extraction-pending",
  "semantics": {
    "effectiveSequence": "Approved documents only, ordered by publication date with base before SIN on ties.",
    "proposedDocuments": "Retained as historical evidence and excluded from the normative effective sequence.",
    "laterSpecifications": "Successor WAP 2.0 material is delta evidence and cannot override strict WAP 1.2.1 behavior."
  },
  "summary": {
    "familyCount": 35,
    "byTargetDisposition": {
      "historical-only": 2,
      "optional-profile": 18,
      "strict-baseline": 8,
      "strict-conditional": 2,
      "strict-supporting": 5
    }
  },
  "families": [
    {
      "family": "architecture",
      "title": "Wireless Application Protocol Architecture",
      "sourceClass": "dependency",
      "targetDisposition": "strict-supporting",
      "ownerLayers": [
        "cross-layer"
      ],
      "completeness": "release-member-chain-complete",
      "interpretationRule": "Start with each approved base and apply approved SINs in effectiveSequence order. A SIN changes only the identified text unless it explicitly supplies a replacement.",
      "effectiveSequence": [
        "WAP-100-WAPArch"
      ],
      "baseDocuments": [
        "WAP-100-WAPArch"
      ],
      "sinDocuments": [],
      "historicalDocuments": [],
      "relationships": [],
      "scrExtraction": {
        "status": "pending-line-item-ledger",
        "governingDocument": "WAP-221-CREQ-20010425-a",
        "note": "SCR tables and SIN changes require line-item extraction; this graph establishes source precedence only."
      },
      "successorEvidence": [
        {
          "documentId": "WAP-210-WAPArch-20010712-a",
          "role": "delta-evidence-only",
          "deltaStatus": "pending"
        }
      ],
      "documents": [
        {
          "documentId": "WAP-100-WAPArch",
          "filename": "WAP-100-WAPArch-19980430-a.pdf",
          "documentRole": "base",
          "publicationStatus": "approved",
          "publishedOn": "1998-04-30",
          "sha256": "22b07da0456889db0dea58d06b0b8d59165421f49a1cdf336aea9abdd6420712",
          "localState": "missing"
        }
      ]
    },
    {
      "family": "cache-operation",
      "title": "Cache Operation",
      "sourceClass": "profile-optional",
      "targetDisposition": "optional-profile",
      "ownerLayers": [
        "engine-wasm",
        "transport-rust"
      ],
      "completeness": "release-member-chain-complete",
      "interpretationRule": "Start with each approved base and apply approved SINs in effectiveSequence order. A SIN changes only the identified text unless it explicitly supplies a replacement.",
      "effectiveSequence": [
        "WAP-175-CacheOp",
        "WAP-175_102-CacheOp"
      ],
      "baseDocuments": [
        "WAP-175-CacheOp"
      ],
      "sinDocuments": [
        "WAP-175_102-CacheOp"
      ],
      "historicalDocuments": [],
      "relationships": [
        {
          "from": "WAP-175-CacheOp",
          "to": "WAP-175_102-CacheOp",
          "type": "applied-before"
        },
        {
          "from": "WAP-175-CacheOp",
          "to": "WAP-175_102-CacheOp",
          "type": "amended-by"
        }
      ],
      "scrExtraction": {
        "status": "pending-line-item-ledger",
        "governingDocument": "WAP-221-CREQ-20010425-a",
        "note": "SCR tables and SIN changes require line-item extraction; this graph establishes source precedence only."
      },
      "successorEvidence": [],
      "documents": [
        {
          "documentId": "WAP-175-CacheOp",
          "filename": "WAP-175-CacheOp-20010731-a.pdf",
          "documentRole": "base",
          "publicationStatus": "approved",
          "publishedOn": "2001-07-31",
          "sha256": "98b9772ebffda32be714c18aa992c160d7ea5226179b967faffb0c66860d7c00",
          "localState": "canonical-exact"
        },
        {
          "documentId": "WAP-175_102-CacheOp",
          "filename": "WAP-175_102-CacheOp-20010816-a.pdf",
          "documentRole": "sin",
          "publicationStatus": "approved",
          "publishedOn": "2001-08-16",
          "sha256": "0cff9648815c1c2850a831a3770321901c4348d77ec7ecb1f92923bb0185eb6f",
          "localState": "canonical-exact"
        }
      ]
    },
    {
      "family": "caching",
      "title": "WAP Caching Model",
      "sourceClass": "dependency",
      "targetDisposition": "strict-supporting",
      "ownerLayers": [
        "engine-wasm",
        "transport-rust"
      ],
      "completeness": "release-member-chain-complete",
      "interpretationRule": "Start with each approved base and apply approved SINs in effectiveSequence order. A SIN changes only the identified text unless it explicitly supplies a replacement.",
      "effectiveSequence": [
        "WAP-120-WAPCachingMod"
      ],
      "baseDocuments": [
        "WAP-120-WAPCachingMod"
      ],
      "sinDocuments": [],
      "historicalDocuments": [],
      "relationships": [],
      "scrExtraction": {
        "status": "line-item-ledger-complete-class-c-applied",
        "governingDocument": "WAP-221-CREQ-20010425-a",
        "governingClassProfileDocument": "WAP-215-ClassConform-20001213-a",
        "ledger": "spec-processing/source-manifests/wap-1.2.1-caching-scr.json",
        "classProfileLedger": "spec-processing/source-manifests/wap-1.2.1-class-conformance.json",
        "selectedProfile": "CCR-CLASSC-C-001",
        "selectedFeatureGroup": "WAPCachingMod:MCF",
        "note": "WAP-120 Appendix A supplies eleven actor-specific caching SCR rows. The selected Class C client applies WAPCachingMod:MCF to the five mandatory user-agent rows; zero-byte cache remains a valid but explicit behavior profile."
      },
      "successorEvidence": [],
      "documents": [
        {
          "documentId": "WAP-120-WAPCachingMod",
          "filename": "WAP-120-WAPCachingMod-20010413-a.pdf",
          "documentRole": "base",
          "publicationStatus": "approved",
          "publishedOn": "2001-04-13",
          "sha256": "8aeacd0a36676d2b22c7ebee211f327049b712ca1ba0dc20faac7af24a9a17ee",
          "localState": "canonical-content-differs"
        }
      ]
    },
    {
      "family": "external-functionality-interface",
      "title": "External Functionality Interface",
      "sourceClass": "profile-optional",
      "targetDisposition": "optional-profile",
      "ownerLayers": [
        "engine-wasm",
        "browser"
      ],
      "completeness": "release-carried-sin-without-base",
      "interpretationRule": "Start with each approved base and apply approved SINs in effectiveSequence order. A SIN changes only the identified text unless it explicitly supplies a replacement.",
      "effectiveSequence": [
        "WAP-231_100-EFI"
      ],
      "baseDocuments": [],
      "sinDocuments": [
        "WAP-231_100-EFI"
      ],
      "historicalDocuments": [],
      "relationships": [],
      "scrExtraction": {
        "status": "pending-line-item-ledger",
        "governingDocument": "WAP-221-CREQ-20010425-a",
        "note": "SCR tables and SIN changes require line-item extraction; this graph establishes source precedence only."
      },
      "successorEvidence": [],
      "documents": [
        {
          "documentId": "WAP-231_100-EFI",
          "filename": "WAP-231_100-EFI-20011018-a.pdf",
          "documentRole": "sin",
          "publicationStatus": "approved",
          "publishedOn": "2001-10-18",
          "sha256": "57f6864a9062ab83f46876c298e07f7b22feb438e48c7729fe3e2bbcaf22eaf3",
          "localState": "missing"
        }
      ]
    },
    {
      "family": "general-formats",
      "title": "WAP General Formats",
      "sourceClass": "dependency",
      "targetDisposition": "strict-supporting",
      "ownerLayers": [
        "cross-layer"
      ],
      "completeness": "release-member-chain-complete",
      "interpretationRule": "Start with each approved base and apply approved SINs in effectiveSequence order. A SIN changes only the identified text unless it explicitly supplies a replacement.",
      "effectiveSequence": [
        "WAP-188-WAPGenFormats"
      ],
      "baseDocuments": [
        "WAP-188-WAPGenFormats"
      ],
      "sinDocuments": [],
      "historicalDocuments": [],
      "relationships": [],
      "scrExtraction": {
        "status": "pending-line-item-ledger",
        "governingDocument": "WAP-221-CREQ-20010425-a",
        "note": "SCR tables and SIN changes require line-item extraction; this graph establishes source precedence only."
      },
      "successorEvidence": [],
      "documents": [
        {
          "documentId": "WAP-188-WAPGenFormats",
          "filename": "WAP-188-WAPGenFormats-20010710-a.pdf",
          "documentRole": "base",
          "publicationStatus": "approved",
          "publishedOn": "2001-07-10",
          "sha256": "a36aadcd2294fbb363fcd5b141614f8bd5861193c6efe9f2c29e6422ba176810",
          "localState": "canonical-content-differs"
        }
      ]
    },
    {
      "family": "interoperability-pictograms",
      "title": "WAP Interoperability Pictograms",
      "sourceClass": "historical",
      "targetDisposition": "historical-only",
      "ownerLayers": [
        "engine-wasm"
      ],
      "completeness": "release-member-chain-complete",
      "interpretationRule": "Start with each approved base and apply approved SINs in effectiveSequence order. A SIN changes only the identified text unless it explicitly supplies a replacement.",
      "effectiveSequence": [],
      "baseDocuments": [],
      "sinDocuments": [],